"id","title","description","filename_disk","filename_download"
"fa34bfc7-3112-4bc2-af9a-aa6405216d73","Abklaerung Diagnostik Schlaflabor Polygraphie Polysomnographie",,"fa34bfc7-3112-4bc2-af9a-aa6405216d73.webp","abklaerung-diagnostik-schlaflabor-polygraphie-polysomnographie.webp"
"d33a348e-e884-472a-90ce-f09463655c85","Abnehmen Gewicht Evidenzbasiert Ohne Diaet Mythen",,"d33a348e-e884-472a-90ce-f09463655c85.webp","abnehmen-gewicht-evidenzbasiert-ohne-diaet-mythen.webp"
"bf688d36-a041-4f37-a2e2-d8c62807e922","Abnehmen Realistisch Was Hilft Und Was Oft Nicht Hilft",,"bf688d36-a041-4f37-a2e2-d8c62807e922.webp","abnehmen-realistisch-was-hilft-und-was-oft-nicht-hilft.webp"
"94b35dc1-36d6-45cc-8ae8-2b2edd7e9c22","Absolut Vs Relativ Zahlen Richtig Lesen",,"94b35dc1-36d6-45cc-8ae8-2b2edd7e9c22.webp","absolut-vs-relativ-zahlen-richtig-lesen.webp"
"856a526b-7458-4cd5-a556-5752e80ad52c","Adhs Autismus Mythen Mode Diagnose Nur Bei Kindern",,"856a526b-7458-4cd5-a556-5752e80ad52c.webp","adhs-autismus-mythen-mode-diagnose-nur-bei-kindern.webp"
"e5c6350b-f65f-4b7a-85e4-bffe5017a6ab","Adhs Verstehen Symptome Alltag Abklaerung",,"e5c6350b-f65f-4b7a-85e4-bffe5017a6ab.webp","adhs-verstehen-symptome-alltag-abklaerung.webp"
"0b96dd60-cca7-4981-9c08-7803d15b07ff","Akuter Rueckenschmerz Schonung Belastung Warnzeichen Einordnen",,"0b96dd60-cca7-4981-9c08-7803d15b07ff.webp","akuter-rueckenschmerz-schonung-belastung-warnzeichen-einordnen.webp"
"8a751613-8e84-49b7-9558-c69a326c05af","Akute Vs Chronische Schmerzen Unterschied",,"8a751613-8e84-49b7-9558-c69a326c05af.webp","akute-vs-chronische-schmerzen-unterschied.webp"
"b221986d-19b3-406f-a494-0e0b3e18e0c6","Akutmittel Medikamentenuebergebrauch Sicher Anwenden Overuse Vermeiden",,"b221986d-19b3-406f-a494-0e0b3e18e0c6.webp","akutmittel-medikamentenuebergebrauch-sicher-anwenden-overuse-vermeiden.webp"
"da04079d-3937-418b-9da9-24a24886107e","Akut Vs Chronisch Rueckenschmerzen Warum Sie Bleiben Und Was Hilft",,"da04079d-3937-418b-9da9-24a24886107e.webp","akut-vs-chronisch-rueckenschmerzen-warum-sie-bleiben-und-was-hilft.webp"
"2d8d556b-5b2f-4334-adde-a879ae595775","Allergietests Behandlung Was Tests Aussagen Und Was Nicht",,"2d8d556b-5b2f-4334-adde-a879ae595775.webp","allergietests-behandlung-was-tests-aussagen-und-was-nicht.webp"
"f3fe361d-cbdb-4f49-a7ee-e515c7c56ae0","Allergie Verstehen Was Im Koerper Passiert Und Welche Formen Es Gibt",,"f3fe361d-cbdb-4f49-a7ee-e515c7c56ae0.webp","allergie-verstehen-was-im-koerper-passiert-und-welche-formen-es-gibt.webp"
"d3e78409-f2c3-4c7d-9cdf-437e32a765c2","Alltagsbewegung Neat Schritte Sitzen Gewicht",,"d3e78409-f2c3-4c7d-9cdf-437e32a765c2.webp","alltagsbewegung-neat-schritte-sitzen-gewicht.webp"
"829c0220-894b-46e8-8859-76fafa7e3bea","Alltagshebel Bewegung Ernaehrung Salz Alkohol Stress Schlaf Realistisch",,"829c0220-894b-46e8-8859-76fafa7e3bea.webp","alltagshebel-bewegung-ernaehrung-salz-alkohol-stress-schlaf-realistisch.webp"
"a8c491ea-ff5c-44f7-98c0-61400e9936f3","Alltagssignale Naechste Schritte Aerztlich Abklaeren Gespraech Vorbereiten",,"a8c491ea-ff5c-44f7-98c0-61400e9936f3.webp","alltagssignale-naechste-schritte-aerztlich-abklaeren-gespraech-vorbereiten.webp"
"e560efc8-5927-4b0c-bfe9-9e60c9dca283","Anaphylaxie Warnzeichen Und Notfall",,"e560efc8-5927-4b0c-bfe9-9e60c9dca283.webp","anaphylaxie-warnzeichen-und-notfall.webp"
"7deaae6e-a3c3-4fda-85c0-68079aa06674","Angst Panik Mythen Panik Ist Gefaehrlich Angst Ist Schwaeche",,"7deaae6e-a3c3-4fda-85c0-68079aa06674.webp","angst-panik-mythen-panik-ist-gefaehrlich-angst-ist-schwaeche.webp"
"9e0ff99f-7ad8-4e3f-8f6d-5d6745c366a2","Angststoerung Panik Symptome Kreislauf Orientierung",,"9e0ff99f-7ad8-4e3f-8f6d-5d6745c366a2.webp","angststoerung-panik-symptome-kreislauf-orientierung.webp"
"fe177ca9-ec09-47f0-ba7a-4ef3a30805ac","Angst Verstehen Symptome Koerperreaktion Wann Normal Wann Abklaeren",,"fe177ca9-ec09-47f0-ba7a-4ef3a30805ac.webp","angst-verstehen-symptome-koerperreaktion-wann-normal-wann-abklaeren.webp"
"641a803f-93bd-484d-85ac-9b3643e75606","Antibiotika Mythen Wann Sie Helfen Und Wann Nicht",,"641a803f-93bd-484d-85ac-9b3643e75606.webp","antibiotika-mythen-wann-sie-helfen-und-wann-nicht.webp"
"8dde442e-3d69-4e96-a359-23266758a335","Antibiotika Wann Sinnvoll Wann Nicht Resistenzen Verstehen",,"8dde442e-3d69-4e96-a359-23266758a335.webp","antibiotika-wann-sinnvoll-wann-nicht-resistenzen-verstehen.webp"
"98f6feec-a843-4137-946c-35720b33e56b","Arteriosklerose Gefaesse Ablagerungen Warum Wichtig",,"98f6feec-a843-4137-946c-35720b33e56b.webp","arteriosklerose-gefaesse-ablagerungen-warum-wichtig.webp"
"d063e9c0-a4fb-4c12-9e2a-eb2149666b8b","Arztbesuch Vorbereiten Unterlagen Fragen Symptome Dokumentieren Orientierung",,"d063e9c0-a4fb-4c12-9e2a-eb2149666b8b.webp","arztbesuch-vorbereiten-unterlagen-fragen-symptome-dokumentieren-orientierung.webp"
"14d3e596-acef-46d3-9e5b-ab79e905600f","Arzt Wechseln Wann Sinnvoll Wie Vorgehen Orientierung",,"14d3e596-acef-46d3-9e5b-ab79e905600f.webp","arzt-wechseln-wann-sinnvoll-wie-vorgehen-orientierung.webp"
"709c72d9-fea6-419c-b0e9-7a826b8e1ca5","Asthma Verstehen Anzeichen Ausloeser Alltag",,"709c72d9-fea6-419c-b0e9-7a826b8e1ca5.webp","asthma-verstehen-anzeichen-ausloeser-alltag.webp"
"79a67667-a5f4-4b8b-a564-7a2b80f6ae31","Atemnot Husten Pfeifende Atmung Warnzeichen Erkennen",,"79a67667-a5f4-4b8b-a564-7a2b80f6ae31.webp","atemnot-husten-pfeifende-atmung-warnzeichen-erkennen.webp"
"c1c5a630-a259-4ed8-ab16-acda9a76a76c","Auffrischungen Impfschutz Titer Intervalle Begriffe",,"c1c5a630-a259-4ed8-ab16-acda9a76a76c.webp","auffrischungen-impfschutz-titer-intervalle-begriffe.webp"
"778d7708-dd9a-4b8e-80b1-9453ab312602","Aufhoeren Entzug Cravings Strategien Rueckfall Was Hilft Orientierung",,"778d7708-dd9a-4b8e-80b1-9453ab312602.webp","aufhoeren-entzug-cravings-strategien-rueckfall-was-hilft-orientierung.webp"
"49b1cfd0-2ea4-48e7-b6fd-bddf0ce7c471","Ausdauertraining Kalorienverbrauch Cardio Realistisch",,"49b1cfd0-2ea4-48e7-b6fd-bddf0ce7c471.webp","ausdauertraining-kalorienverbrauch-cardio-realistisch.webp"
"01948a9d-4931-4b34-8c87-f219e3648f3d","Ausloeser Risikofaktoren Rauchen Luftschadstoffe Infekte Allergien",,"01948a9d-4931-4b34-8c87-f219e3648f3d.webp","ausloeser-risikofaktoren-rauchen-luftschadstoffe-infekte-allergien.webp"
"f3dddae3-70d9-4a52-8692-0e41397bd795","Autismus Spektrum Verstehen Merkmale Missverstaendnisse Abklaerung",,"f3dddae3-70d9-4a52-8692-0e41397bd795.webp","autismus-spektrum-verstehen-merkmale-missverstaendnisse-abklaerung.webp"
"7c8086c5-feb7-465f-b670-bb687f238707","Befunde Fragenkatalog Untersuchungsergebnisse Einordnen",,"7c8086c5-feb7-465f-b670-bb687f238707.webp","befunde-fragenkatalog-untersuchungsergebnisse-einordnen.webp"
"426c20e1-d49b-47df-8348-67ad2d96d1a3","Befunde Nach Screening Auffaellig Bedeutung Naechste Schritte",,"426c20e1-d49b-47df-8348-67ad2d96d1a3.webp","befunde-nach-screening-auffaellig-bedeutung-naechste-schritte.webp"
"57d270a1-b28f-446a-a1c4-22ad5ceebd51","Befundkopie Einsicht Unterlagen Bekommen Orientierung",,"57d270a1-b28f-446a-a1c4-22ad5ceebd51.webp","befundkopie-einsicht-unterlagen-bekommen-orientierung.webp"
"ef719098-47c3-4eeb-9062-4701386c97e2","Befund Sprache Verstehen Haeufige Begriffe Unklar Auffaellig Orientierung",,"ef719098-47c3-4eeb-9062-4701386c97e2.webp","befund-sprache-verstehen-haeufige-begriffe-unklar-auffaellig-orientierung.webp"
"3733be19-2010-409e-bcbc-72bbfd3cd7f6","Behandlung Koordinieren Ueberweisungen Befunde Schnittstellen Orientierung",,"3733be19-2010-409e-bcbc-72bbfd3cd7f6.webp","behandlung-koordinieren-ueberweisungen-befunde-schnittstellen-orientierung.webp"
"258d6523-d09d-43ff-8bae-6e9a660a482b","Behandlungsfehler Was Es Ist Welche Schritte Moeglich Sind Orientierung",,"258d6523-d09d-43ff-8bae-6e9a660a482b.webp","behandlungsfehler-was-es-ist-welche-schritte-moeglich-sind-orientierung.webp"
"9deeaa11-b75e-45c0-8a49-699d37d4bf57","Beipackzettel Wirkstoffe Infos Richtig Lesen Orientierung",,"9deeaa11-b75e-45c0-8a49-699d37d4bf57.webp","beipackzettel-wirkstoffe-infos-richtig-lesen-orientierung.webp"
"c70a3ae8-c5b8-4cea-be19-8ae6891fd5b7","Beschwerden Aerztekammer Zahnaerztekammer Berufsvertretungen Orientierung",,"c70a3ae8-c5b8-4cea-be19-8ae6891fd5b7.webp","beschwerden-aerztekammer-zahnaerztekammer-berufsvertretungen-orientierung.webp"
"2b676a3e-2071-404a-86c2-a2f95293854a","Beschwerden Krankenhaus Pflege Heimaufsicht Orientierung",,"2b676a3e-2071-404a-86c2-a2f95293854a.webp","beschwerden-krankenhaus-pflege-heimaufsicht-orientierung.webp"
"b840ecf5-e79f-4de7-8db3-e4b5f6df0d20","Beschwerden Krankenkasse Sozialversicherung Orientierung",,"b840ecf5-e79f-4de7-8db3-e4b5f6df0d20.webp","beschwerden-krankenkasse-sozialversicherung-orientierung.webp"
"e50f31c3-0cad-442d-9bd1-7393ff9a9d6f","Beschwerden Ombudsstellen Patientenanwaltschaft Orientierung",,"e50f31c3-0cad-442d-9bd1-7393ff9a9d6f.webp","beschwerden-ombudsstellen-patientenanwaltschaft-orientierung.webp"
"944f0773-1a5d-47a1-a036-57e51aecc616","Beschwerden Vorbereiten Dokumentation Unterlagen Ablauf Protokollieren Orientierung",,"944f0773-1a5d-47a1-a036-57e51aecc616.webp","beschwerden-vorbereiten-dokumentation-unterlagen-ablauf-protokollieren-orientierung.webp"
"2ca1186c-7d47-4709-b891-d38fea061d9f","Bewegung Wirkt Ausdauer Kraft Alltagsschritte",,"2ca1186c-7d47-4709-b891-d38fea061d9f.webp","bewegung-wirkt-ausdauer-kraft-alltagsschritte.webp"
"ccb29c6f-9799-4021-b942-86598a4a2905","Blutdruck Mythen Einmal Hoch Salz Messfehler",,"ccb29c6f-9799-4021-b942-86598a4a2905.webp","blutdruck-mythen-einmal-hoch-salz-messfehler.webp"
"88126e93-f312-44dd-9255-0f8c1a961c7b","Blutdruck Richtig Messen Zuhause Praxis 24h Typische Fehler Vermeiden",,"88126e93-f312-44dd-9255-0f8c1a961c7b.webp","blutdruck-richtig-messen-zuhause-praxis-24h-typische-fehler-vermeiden.webp"
"9767208d-97bf-4b7b-9576-c17710b4bd58","Blutdruck Verstehen Werte Messung Und Einordnung",,"9767208d-97bf-4b7b-9576-c17710b4bd58.webp","blutdruck-verstehen-werte-messung-und-einordnung.webp"
"64273c1f-06e3-4d27-9947-e646569f2841","Bluthochdruck Verstehen Was Es Ist Warum Es Oft Unbemerkt Bleibt Was Werte Bedeuten",,"64273c1f-06e3-4d27-9947-e646569f2841.webp","bluthochdruck-verstehen-was-es-ist-warum-es-oft-unbemerkt-bleibt-was-werte-bedeuten.webp"
"91eb0554-f791-4286-a83a-a99c1250984f","Blutzucker Hba1c Werte Verstehen",,"91eb0554-f791-4286-a83a-a99c1250984f.webp","blutzucker-hba1c-werte-verstehen.webp"
"3c69d8de-0c00-4fe6-a8d2-2862f6d6d2d1","Brustschmerz Atemnot Starke Schmerzen Sofortzeichen",,"3c69d8de-0c00-4fe6-a8d2-2862f6d6d2d1.webp","brustschmerz-atemnot-starke-schmerzen-sofortzeichen.webp"
"4a32d3fc-2039-4abf-9a6b-d35e19b49948","Burnout Und Arbeit Warnzeichen Abgrenzung Depression Naechste Schritte",,"4a32d3fc-2039-4abf-9a6b-d35e19b49948.webp","burnout-und-arbeit-warnzeichen-abgrenzung-depression-naechste-schritte.webp"
"6e29e41f-b1b7-4deb-a308-6021f1e87d8e","Checkliste Fragen Igel Selbstzahlerleistungen",,"6e29e41f-b1b7-4deb-a308-6021f1e87d8e.webp","checkliste-fragen-igel-selbstzahlerleistungen.webp"
"27fce453-2ae7-4af5-86ca-4d11eaaafe62","Cholesterin Blutfette Ldl Hdl Triglyceride Einordnen",,"27fce453-2ae7-4af5-86ca-4d11eaaafe62.webp","cholesterin-blutfette-ldl-hdl-triglyceride-einordnen.webp"
"84d1b38a-f09e-4fc7-910b-6c546c449cff","Cholesterin Blutfette Ldl Hdl Triglyzeride Verstehen",,"84d1b38a-f09e-4fc7-910b-6c546c449cff.webp","cholesterin-blutfette-ldl-hdl-triglyzeride-verstehen.webp"
"ed7b0627-6e93-4b5f-bd70-f6018dcc8680","Cholesterin Und Fette Einordnung",,"ed7b0627-6e93-4b5f-bd70-f6018dcc8680.webp","cholesterin-und-fette-einordnung.webp"
"8b31ff0a-1c2d-41df-b31f-3c1325ba6cc1","Chronische Atemwegserkrankungen Verstehen Asthma Copd Chronische Bronchitis",,"8b31ff0a-1c2d-41df-b31f-3c1325ba6cc1.webp","chronische-atemwegserkrankungen-verstehen-asthma-copd-chronische-bronchitis.webp"
"58f6a6a0-b912-4941-932c-91f5d7865e1c","Chronische Rueckenschmerzen Alltagsbewegung Ausdauer Raus Aus Der Schonung",,"58f6a6a0-b912-4941-932c-91f5d7865e1c.webp","chronische-rueckenschmerzen-alltagsbewegung-ausdauer-raus-aus-der-schonung.webp"
"db2a2643-9489-4c0e-8b28-bfcfae013a29","Chronische Rueckenschmerzen Kraft Core Stabilitaet",,"db2a2643-9489-4c0e-8b28-bfcfae013a29.webp","chronische-rueckenschmerzen-kraft-core-stabilitaet.webp"
"41b4f853-1d37-40dc-afb8-eb2d94bcfd4d","Chronische Rueckenschmerzen Physio Reha Alltag Umsetzung Statt Schonung",,"41b4f853-1d37-40dc-afb8-eb2d94bcfd4d.webp","chronische-rueckenschmerzen-physio-reha-alltag-umsetzung-statt-schonung.webp"
"a0721017-aafd-406b-b235-154215dec159","Cluster Kopfschmerzen Typische Zeichen Abgrenzung",,"a0721017-aafd-406b-b235-154215dec159.webp","cluster-kopfschmerzen-typische-zeichen-abgrenzung.webp"
"75e8d153-bd96-45b4-9565-14ce1d82de9f","Darmkrebs Frueherkennung Stuhltest Koloskopie Intervalle Orientierung",,"75e8d153-bd96-45b4-9565-14ce1d82de9f.webp","darmkrebs-frueherkennung-stuhltest-koloskopie-intervalle-orientierung.webp"
"e95ef51d-0e7a-4cd6-9a2f-faba8512aadd","Darmreinigung Detox Kuren Versprechen Evidenz",,"e95ef51d-0e7a-4cd6-9a2f-faba8512aadd.webp","darmreinigung-detox-kuren-versprechen-evidenz.webp"
"87a3a196-50ae-4acc-bbb9-662f244ce8f9","Datenschutz Gesundheitsbereich Einwilligung Schweigepflicht Weitergabe",,"87a3a196-50ae-4acc-bbb9-662f244ce8f9.webp","datenschutz-gesundheitsbereich-einwilligung-schweigepflicht-weitergabe.webp"
"949b38a4-f6ac-47cb-ac0c-9ee0d0f26515","Depression Anzeichen Einordnen Und Was Realistisch Helfen Kann",,"949b38a4-f6ac-47cb-ac0c-9ee0d0f26515.webp","depression-anzeichen-einordnen-und-was-realistisch-helfen-kann.webp"
"ec7153e7-7196-494d-9481-f249556cc6b7","Depression Mythen Nur Schlechte Laune Reiss Dich Zusammen Einordnung",,"ec7153e7-7196-494d-9481-f249556cc6b7.webp","depression-mythen-nur-schlechte-laune-reiss-dich-zusammen-einordnung.webp"
"96e57454-6c72-4428-a835-e3b25729dc10","Depression Und Angst Verstehen Begriffe Haeufigkeit Alltag",,"96e57454-6c72-4428-a835-e3b25729dc10.webp","depression-und-angst-verstehen-begriffe-haeufigkeit-alltag.webp"
"2a2f6b06-bb20-4085-bc99-e7a87c150f46","Depression Verstehen Symptome Verlauf Abgrenzung",,"2a2f6b06-bb20-4085-bc99-e7a87c150f46.webp","depression-verstehen-symptome-verlauf-abgrenzung.webp"
"a1dd27c7-c4e1-4532-976e-e66d8d276ea1","Detox Entgiften Schlacken Was Stimmt Und Was Nicht",,"a1dd27c7-c4e1-4532-976e-e66d8d276ea1.webp","detox-entgiften-schlacken-was-stimmt-und-was-nicht.webp"
"489220e2-0e62-48d7-badb-bce7d2b5171d","Diabetes Erkennen Diagnostik Bedeutung Der Diagnose",,"489220e2-0e62-48d7-badb-bce7d2b5171d.webp","diabetes-erkennen-diagnostik-bedeutung-der-diagnose.webp"
"0115c09b-cdf2-4d4a-8320-9dcc3aac1353","Diabetes Im Alltag Ernaehrung Bewegung Stress Schlaf",,"0115c09b-cdf2-4d4a-8320-9dcc3aac1353.webp","diabetes-im-alltag-ernaehrung-bewegung-stress-schlaf.webp"
"099c1d2a-b240-4393-8ade-9adcbcfe6216","Diabetes Mythen Nur Zucker Selbst Schuld Typ 2 Vermeidbar",,"099c1d2a-b240-4393-8ade-9adcbcfe6216.webp","diabetes-mythen-nur-zucker-selbst-schuld-typ-2-vermeidbar.webp"
"3e0165a1-6eef-4a5f-be35-046363676a5c","Diabetes Und Medikamente Was Sie Tun Ohne Therapieempfehlung",,"3e0165a1-6eef-4a5f-be35-046363676a5c.webp","diabetes-und-medikamente-was-sie-tun-ohne-therapieempfehlung.webp"
"aa3f8442-006e-4240-9e60-c8b53f166578","Diabetes Verstehen Formen Und Unterschiede",,"aa3f8442-006e-4240-9e60-c8b53f166578.webp","diabetes-verstehen-formen-und-unterschiede.webp"
"02ceea21-41a7-4336-8179-94cbd782e759","Diaeten Trends Low Carb Keto Intervallfasten Nutzen Risiken Ohne Hype",,"02ceea21-41a7-4336-8179-94cbd782e759.webp","diaeten-trends-low-carb-keto-intervallfasten-nutzen-risiken-ohne-hype.webp"
"56f42481-35d2-443e-8dd7-cbefc07654e1","Diagnostik Bildgebung Wann Sind Mrt Ct Roentgen Sinnvoll",,"56f42481-35d2-443e-8dd7-cbefc07654e1.webp","diagnostik-bildgebung-wann-sind-mrt-ct-roentgen-sinnvoll.webp"
"c3bb0403-c56b-4698-9bc3-76333ea239fd","Diagnostik Copd Asthma Lungenfunktion Peak Flow Spirometrie",,"c3bb0403-c56b-4698-9bc3-76333ea239fd.webp","diagnostik-copd-asthma-lungenfunktion-peak-flow-spirometrie.webp"
"e4c19902-29f8-4f0e-8e8e-11ad3520eba6","E Card Und Organisation Orientierung",,"e4c19902-29f8-4f0e-8e8e-11ad3520eba6.webp","e-card-und-organisation-orientierung.webp"
"001bb0e0-8d78-41a2-95a2-1a064d1f14c4","Elga Und Befunde Was Gespeichert Ist Zugriff Einsicht Orientierung",,"001bb0e0-8d78-41a2-95a2-1a064d1f14c4.webp","elga-und-befunde-was-gespeichert-ist-zugriff-einsicht-orientierung.webp"
"b85d0d75-bf39-402a-8ee9-aa58e7f61c01","Energydrinks Koffein Zucker Risiken Jugendliche",,"b85d0d75-bf39-402a-8ee9-aa58e7f61c01.webp","energydrinks-koffein-zucker-risiken-jugendliche.webp"
"2fda355e-b94a-43af-bfda-c539bd5dfe73","Entscheiden Bei Vorsorge Fragen Befunde Zweitmeinung",,"2fda355e-b94a-43af-bfda-c539bd5dfe73.webp","entscheiden-bei-vorsorge-fragen-befunde-zweitmeinung.webp"
"44219963-4e8b-486c-b0a5-570d5fa8e3db","Entscheidungen Rund Um Screening Fragen Die Helfen Ohne Empfehlung",,"44219963-4e8b-486c-b0a5-570d5fa8e3db.webp","entscheidungen-rund-um-screening-fragen-die-helfen-ohne-empfehlung.webp"
"8cc71919-504e-48d1-a8e4-2102971d9df8","Entspannung Tools Atmung Bewegung Pausen Routinen",,"8cc71919-504e-48d1-a8e4-2102971d9df8.webp","entspannung-tools-atmung-bewegung-pausen-routinen.webp"
"8535bacb-9703-4e06-ad82-7eb4b0e98fcd","Entzuendungswerte Crp Leukozyten Orientierung",,"8535bacb-9703-4e06-ad82-7eb4b0e98fcd.webp","entzuendungswerte-crp-leukozyten-orientierung.webp"
"6e88ef1a-b491-4cec-a5e1-768bbd5bcdec","Ernaehrung Heilt Krebs Heilsversprechen Einordnen",,"6e88ef1a-b491-4cec-a5e1-768bbd5bcdec.webp","ernaehrung-heilt-krebs-heilsversprechen-einordnen.webp"
"4e1bd6c5-71e4-4f6d-ad39-814249877e6e","Ernaehrung Verstehen Energie Makros Ballaststoffe Alltag",,"4e1bd6c5-71e4-4f6d-ad39-814249877e6e.webp","ernaehrung-verstehen-energie-makros-ballaststoffe-alltag.webp"
"792cad9b-1f9b-41a6-991e-c22e26ee16d8","Erschoepfung Burnout Warnzeichen Abgrenzung Naechste Schritte",,"792cad9b-1f9b-41a6-991e-c22e26ee16d8.webp","erschoepfung-burnout-warnzeichen-abgrenzung-naechste-schritte.webp"
"992b9551-05dd-450b-8ac0-6f7e569774ec","E Zigaretten Tabakerhitzer Orientierung",,"992b9551-05dd-450b-8ac0-6f7e569774ec.webp","e-zigaretten-tabakerhitzer-orientierung.webp"
"3c014e5a-9e50-4a96-81c0-9f7037c6880a","Fette Salz Herzgesund Essen Ohne Uebertreibung",,"3c014e5a-9e50-4a96-81c0-9f7037c6880a.webp","fette-salz-herzgesund-essen-ohne-uebertreibung.webp"
"aa803dba-2958-42bc-93be-17cbf0895338","Fieber Und Infekt Einordnen Hausmittel Abklaerung Alarmzeichen",,"aa803dba-2958-42bc-93be-17cbf0895338.webp","fieber-und-infekt-einordnen-hausmittel-abklaerung-alarmzeichen.webp"
"58ec570a-36dd-449b-a7c3-202bbeb120bb","Folgeerkrankungen Bei Diabetes Risiken Verstehen",,"58ec570a-36dd-449b-a7c3-202bbeb120bb.webp","folgeerkrankungen-bei-diabetes-risiken-verstehen.webp"
"23d6828b-d454-4d84-9f7c-7bb571407201","Folgen Risiken Uebergewicht Koerper",,"23d6828b-d454-4d84-9f7c-7bb571407201.webp","folgen-risiken-uebergewicht-koerper.webp"
"f875ad11-63f9-4690-bc93-da388772e622","Frauen Maennergesundheit Vorsorge Untersuchungen Orientierung",,"f875ad11-63f9-4690-bc93-da388772e622.webp","frauen-maennergesundheit-vorsorge-untersuchungen-orientierung.webp"
"7c51bf08-e510-4834-8583-535f4264f5cd","Frueherkennung Immer Gut Nutzen Risiken Ueberdiagnosen",,"7c51bf08-e510-4834-8583-535f4264f5cd.webp","frueherkennung-immer-gut-nutzen-risiken-ueberdiagnosen.webp"
"31edf183-2a72-472d-8201-4ae78e287b51","Frueherkennung Und Screening Verstehen Was Wird Gesucht Und Warum",,"31edf183-2a72-472d-8201-4ae78e287b51.webp","frueherkennung-und-screening-verstehen-was-wird-gesucht-und-warum.webp"
"ca37fd89-6d11-4f63-99b2-4476bde73017","Gebaermutterhals Frueherkennung Pap Test Hpv Test Ergebnisse Einordnen",,"ca37fd89-6d11-4f63-99b2-4476bde73017.webp","gebaermutterhals-frueherkennung-pap-test-hpv-test-ergebnisse-einordnen.webp"
"f7355a24-bee7-481e-888c-34fb16e42c55","Gesundheitsrisiken Blutdruck Krebs Leber Evidenz",,"f7355a24-bee7-481e-888c-34fb16e42c55.webp","gesundheitsrisiken-blutdruck-krebs-leber-evidenz.webp"
"e590fafa-eeb3-4429-b388-d2d6682843a3","Gluten Laktose Unvertraeglichkeiten Richtig Einordnen",,"e590fafa-eeb3-4429-b388-d2d6682843a3.webp","gluten-laktose-unvertraeglichkeiten-richtig-einordnen.webp"
"94ae2144-8174-4b3d-92b7-7d0c98135412","Gute Fragen Stellen Diagnose Optionen Risiken Orientierung",,"94ae2144-8174-4b3d-92b7-7d0c98135412.webp","gute-fragen-stellen-diagnose-optionen-risiken-orientierung.webp"
"fac8b953-e12f-4f11-b509-8cf34f57cb63","Hautkrebs Vorbeugen Uv Sonnenschutz Solarium Warnzeichen",,"fac8b953-e12f-4f11-b509-8cf34f57cb63.webp","hautkrebs-vorbeugen-uv-sonnenschutz-solarium-warnzeichen.webp"
"b29da467-6ef0-4409-bb08-5d936d5d9f35","Herzinfarkt Mythen Typische Fehlannahmen Warnzeichen Orientierung",,"b29da467-6ef0-4409-bb08-5d936d5d9f35.webp","herzinfarkt-mythen-typische-fehlannahmen-warnzeichen-orientierung.webp"
"f95057a9-266a-4da0-99da-a5d8079ecd33","Herzinfarkt Mythen Warnzeichen Orientierung",,"f95057a9-266a-4da0-99da-a5d8079ecd33.webp","herzinfarkt-mythen-warnzeichen-orientierung.webp"
"e018dc92-350b-405a-81dc-c82c608718e7","Herzinsuffizienz Was Das Herz Nicht Mehr Schafft Und Was Das Im Alltag Bedeutet",,"e018dc92-350b-405a-81dc-c82c608718e7.webp","herzinsuffizienz-was-das-herz-nicht-mehr-schafft-und-was-das-im-alltag-bedeutet.webp"
"086617bb-690a-4463-a779-4c2d48d87938","Herz Kreislauf Risiko Checks Blutdruck Blutfette Diabetes",,"086617bb-690a-4463-a779-4c2d48d87938.webp","herz-kreislauf-risiko-checks-blutdruck-blutfette-diabetes.webp"
"697146eb-59fd-4866-9b2b-fd6d5a328c1c","Herzrhythmus Vorhofflimmern Unregelmaessiger Puls",,"697146eb-59fd-4866-9b2b-fd6d5a328c1c.webp","herzrhythmus-vorhofflimmern-unregelmaessiger-puls.webp"
"cbba050b-546f-4456-b8b9-e6b9b0456516","Herz Untersuchungen Verstehen Ekg Echo Belastungstest Labor",,"cbba050b-546f-4456-b8b9-e6b9b0456516.webp","herz-untersuchungen-verstehen-ekg-echo-belastungstest-labor.webp"
"7acc2a8e-ff78-4441-b518-60cd04c1a7dc","Heuschnupfen Pollenallergie Symptome Saison Was Hilft",,"7acc2a8e-ff78-4441-b518-60cd04c1a7dc.webp","heuschnupfen-pollenallergie-symptome-saison-was-hilft.webp"
"a63f37eb-0c0c-404b-9fb4-8191edcca1ae","Hilfe Bei Abhaengigkeit Anlaufstellen Therapieoptionen Rueckfall Orientierung",,"a63f37eb-0c0c-404b-9fb4-8191edcca1ae.webp","hilfe-bei-abhaengigkeit-anlaufstellen-therapieoptionen-rueckfall-orientierung.webp"
"a2fad2c8-a91e-4a2e-b1a3-3fab11ae358f","Hilfe Finden Anlaufstellen Gespraech Behandlung",,"a2fad2c8-a91e-4a2e-b1a3-3fab11ae358f.webp","hilfe-finden-anlaufstellen-gespraech-behandlung.webp"
"7d8b12ba-e820-49eb-bfa6-9edbf98433e6","Hilfe Finden Gespraech Therapieformen Anlaufstellen Orientierung",,"7d8b12ba-e820-49eb-bfa6-9edbf98433e6.webp","hilfe-finden-gespraech-therapieformen-anlaufstellen-orientierung.webp"
"7e2b9f0f-aa64-4204-a612-9dfe21f53adb","Hilfe Finden Hausarzt Psychotherapie Notfall Naechste Schritte",,"7e2b9f0f-aa64-4204-a612-9dfe21f53adb.webp","hilfe-finden-hausarzt-psychotherapie-notfall-naechste-schritte.webp"
"35065573-d667-4624-b076-492592e01e42","Hilfe Nach Belastenden Ereignissen Anlaufstellen Therapieformen Orientierung",,"35065573-d667-4624-b076-492592e01e42.webp","hilfe-nach-belastenden-ereignissen-anlaufstellen-therapieformen-orientierung.webp"
"de67910a-f4ac-48ac-b180-89b2d78bfd6c","Hormone Machen Dick Gewicht Stoffwechsel Fehlannahmen",,"de67910a-f4ac-48ac-b180-89b2d78bfd6c.webp","hormone-machen-dick-gewicht-stoffwechsel-fehlannahmen.webp"
"5ff14f8a-3c07-4bdd-86c0-2048d332eb32","Igel Selbstzahlerleistungen Verstehen",,"5ff14f8a-3c07-4bdd-86c0-2048d332eb32.webp","igel-selbstzahlerleistungen-verstehen.webp"
"ac123770-20ed-4428-a912-b0544f766e4a","Im Krankenhaus Aufnahme Ablaeufe Entlassung Orientierung",,"ac123770-20ed-4428-a912-b0544f766e4a.webp","im-krankenhaus-aufnahme-ablaeufe-entlassung-orientierung.webp"
"399459f0-b060-4092-96bd-e8f16d4ac189","Impf Mythen Erkennen Typische Behauptungen Pruefen",,"399459f0-b060-4092-96bd-e8f16d4ac189.webp","impf-mythen-erkennen-typische-behauptungen-pruefen.webp"
"9e79f93d-416a-4003-a17b-c81d23120fab","Impfplan Oesterreich Erwachsene Senioren Orientierung",,"9e79f93d-416a-4003-a17b-c81d23120fab.webp","impfplan-oesterreich-erwachsene-senioren-orientierung.webp"
"69b65e97-56b4-41a8-8c57-2d1278766626","Impfplan Oesterreich Kinder Jugendliche Orientierung",,"69b65e97-56b4-41a8-8c57-2d1278766626.webp","impfplan-oesterreich-kinder-jugendliche-orientierung.webp"
"72fbae22-1443-4af3-895b-dad325f12d1c","Impfplan Oesterreich Schwangerschaft Stillzeit Kinderwunsch Orientierung",,"72fbae22-1443-4af3-895b-dad325f12d1c.webp","impfplan-oesterreich-schwangerschaft-stillzeit-kinderwunsch-orientierung.webp"
"de57b931-9ebe-4c85-9688-81b660208b48","Impfplan Oesterreich Ueberblick Logik Lesen Orientierung",,"de57b931-9ebe-4c85-9688-81b660208b48.webp","impfplan-oesterreich-ueberblick-logik-lesen-orientierung.webp"
"1714e39a-b1a6-4228-8306-aaf26d5c0d53","Impfungen Verstehen Nutzen Risiken Wirksamkeit Studien",,"1714e39a-b1a6-4228-8306-aaf26d5c0d53.webp","impfungen-verstehen-nutzen-risiken-wirksamkeit-studien.webp"
"a8d29bb8-2e9e-48c3-8b6a-5fd1bb1adfaf","Indikationsimpfungen Beruf Ausbildung Exposition Orientierung",,"a8d29bb8-2e9e-48c3-8b6a-5fd1bb1adfaf.webp","indikationsimpfungen-beruf-ausbildung-exposition-orientierung.webp"
"0fa62e72-1b52-4668-9c48-e14ec57db3a4","Indikationsimpfungen Besondere Situationen Kontaktpersonen Orientierung",,"0fa62e72-1b52-4668-9c48-e14ec57db3a4.webp","indikationsimpfungen-besondere-situationen-kontaktpersonen-orientierung.webp"
"d144bb55-3e15-4d46-a8ca-c79eb556814d","Indikationsimpfungen Chronische Erkrankungen Immunsuppression Orientierung",,"d144bb55-3e15-4d46-a8ca-c79eb556814d.webp","indikationsimpfungen-chronische-erkrankungen-immunsuppression-orientierung.webp"
"8ac987ee-709e-4bbe-9270-c06a6431a060","Indikationsimpfungen Reise Reisemedizin Orientierung",,"8ac987ee-709e-4bbe-9270-c06a6431a060.webp","indikationsimpfungen-reise-reisemedizin-orientierung.webp"
