"id","title","description","filename_disk","filename_download"
"13b6a05b-8e5a-4f2e-8710-3812337e5db4","Insomnie Verstehen EIN Und Durchschlafprobleme Orientierung",,"13b6a05b-8e5a-4f2e-8710-3812337e5db4.webp","insomnie-verstehen-ein-und-durchschlafprobleme-orientierung.webp"
"acf35bdc-9a8e-4031-ab68-8432c966b445","Interessenkonflikte Erkennen Werbung Studien Empfehlungen Einordnen",,"acf35bdc-9a8e-4031-ab68-8432c966b445.webp","interessenkonflikte-erkennen-werbung-studien-empfehlungen-einordnen.webp"
"6746ff84-0f85-4df3-b97b-bdf7e9153b44","Interessenkonflikte Werbung Empfehlungen Beeinflusst",,"6746ff84-0f85-4df3-b97b-bdf7e9153b44.webp","interessenkonflikte-werbung-empfehlungen-beeinflusst.webp"
"19cd65b7-d629-4daf-94be-dc3dff951d16","Isg Bandscheibe Ischias Ausstrahlende Schmerzen",,"19cd65b7-d629-4daf-94be-dc3dff951d16.webp","isg-bandscheibe-ischias-ausstrahlende-schmerzen.webp"
"abc12d50-a164-4dfc-87cb-6ccb0c74a7d9","Khk Angina Herzinfarkt Was Es Ist Und Woran Man Es Erkennt",,"abc12d50-a164-4dfc-87cb-6ccb0c74a7d9.webp","khk-angina-herzinfarkt-was-es-ist-und-woran-man-es-erkennt.webp"
"6bc1799e-08e0-4207-9b33-a445f2695f8c","Kinderwunsch Hormone Haeufige Mythen Orientierung",,"6bc1799e-08e0-4207-9b33-a445f2695f8c.webp","kinderwunsch-hormone-haeufige-mythen-orientierung.webp"
"886cd9b4-d3e8-496e-97e0-fbbbf7b6c0cb","Knacken Dehnen Faszien Was Stimmt Und Was Wird Uebertrieben",,"886cd9b4-d3e8-496e-97e0-fbbbf7b6c0cb.webp","knacken-dehnen-faszien-was-stimmt-und-was-wird-uebertrieben.webp"
"3bde37c1-b631-4cfb-a909-8c7fbed1f141","Koffein Energy Drinks Mythen Risiken Grenzwerte",,"3bde37c1-b631-4cfb-a909-8c7fbed1f141.webp","koffein-energy-drinks-mythen-risiken-grenzwerte.webp"
"6f2ee24b-ccd5-469e-9798-9b197f60aead","Koffein Schlaf Stress Timing Abendroutine Wechselwirkungen",,"6f2ee24b-ccd5-469e-9798-9b197f60aead.webp","koffein-schlaf-stress-timing-abendroutine-wechselwirkungen.webp"
"a86834da-3089-4d39-b550-a1dbb73fdd77","Koffein Verstehen Wirkung Abbau Unterschiede",,"a86834da-3089-4d39-b550-a1dbb73fdd77.webp","koffein-verstehen-wirkung-abbau-unterschiede.webp"
"d97b9b94-6745-42db-8495-0d8e023a7498","Kontrastmittel Wozu Risiken Wann Vorsicht Orientierung",,"d97b9b94-6745-42db-8495-0d8e023a7498.webp","kontrastmittel-wozu-risiken-wann-vorsicht-orientierung.webp"
"2d06ca87-4d74-4164-a9bb-3cecd08187b6","Kopfschmerzen Verstehen Haeufige Arten Ursachen Verlauf",,"2d06ca87-4d74-4164-a9bb-3cecd08187b6.webp","kopfschmerzen-verstehen-haeufige-arten-ursachen-verlauf.webp"
"947a5e39-0d11-4e20-9839-13c2098f5ab4","Krafttraining Muskelmasse Abnehmen Einordnung",,"947a5e39-0d11-4e20-9839-13c2098f5ab4.webp","krafttraining-muskelmasse-abnehmen-einordnung.webp"
"1e3d505e-708f-430d-8132-4b77e9fef484","Krebs Frueherkennung Screenings Fuer Wen",,"1e3d505e-708f-430d-8132-4b77e9fef484.webp","krebs-frueherkennung-screenings-fuer-wen.webp"
"f2534d39-8631-4580-b651-203e8ecefee2","Krebsfrueherkennung Verstehen Nutzen Risiken Ueberdiagnose",,"f2534d39-8631-4580-b651-203e8ecefee2.webp","krebsfrueherkennung-verstehen-nutzen-risiken-ueberdiagnose.webp"
"d461e872-c6dd-4f12-9cae-91948095755b","Laborwerte Lesen Referenzbereiche Einheiten Abweichungen",,"d461e872-c6dd-4f12-9cae-91948095755b.webp","laborwerte-lesen-referenzbereiche-einheiten-abweichungen.webp"
"98307e1d-7d85-4519-b12c-e00409b66506","Leben Mit Copd Asthma Alltag Bewegung Atemtechniken Inhalation Exazerbationen Vermeiden",,"98307e1d-7d85-4519-b12c-e00409b66506.webp","leben-mit-copd-asthma-alltag-bewegung-atemtechniken-inhalation-exazerbationen-vermeiden.webp"
"d4b3c88c-34ad-452c-b6a6-e5d8b33cd045","Long Covid Typische Behauptungen Was Belegt Ist Und Was Nicht",,"d4b3c88c-34ad-452c-b6a6-e5d8b33cd045.webp","long-covid-typische-behauptungen-was-belegt-ist-und-was-nicht.webp"
"7c77333e-d3a5-4372-9703-3c206202cc85","Low Carb Keto Diabetes Plausibel Uebertrieben",,"7c77333e-d3a5-4372-9703-3c206202cc85.webp","low-carb-keto-diabetes-plausibel-uebertrieben.webp"
"f23d4c86-41c7-4b62-900c-b526bcece845","Mammographie Screening Brustkrebs Frueherkennung Nutzen Risiken Orientierung",,"f23d4c86-41c7-4b62-900c-b526bcece845.webp","mammographie-screening-brustkrebs-frueherkennung-nutzen-risiken-orientierung.webp"
"c9308dfe-6caf-4a52-933c-9a9711760467","Me Cfs Verstehen Abgrenzung Pem Missverstaendnisse Orientierung",,"c9308dfe-6caf-4a52-933c-9a9711760467.webp","me-cfs-verstehen-abgrenzung-pem-missverstaendnisse-orientierung.webp"
"99b33410-79e9-4598-9a3a-911a47ab4002","Medikamente Verstehen Klassen Wirkungsidee Nebenwirkungen",,"99b33410-79e9-4598-9a3a-911a47ab4002.webp","medikamente-verstehen-klassen-wirkungsidee-nebenwirkungen.webp"
"995dd52f-8e9e-4d21-8045-3cc061f39835","Migraene Attacken Aura Ausloeser Was Wirklich Hilft",,"995dd52f-8e9e-4d21-8045-3cc061f39835.webp","migraene-attacken-aura-ausloeser-was-wirklich-hilft.webp"
"290fc7d4-57ed-48b9-bf3c-d4b05f6c0b83","Mikrobiom Mythen Was Gesichert Ist Und Was Marketing Ist",,"290fc7d4-57ed-48b9-bf3c-d4b05f6c0b83.webp","mikrobiom-mythen-was-gesichert-ist-und-was-marketing-ist.webp"
"d276f399-3a8b-487c-a35b-76d2a9f900ce","Motivation Und Belohnung Warum Wir Scheitern Und Was Hilft Ohne Moral",,"d276f399-3a8b-487c-a35b-76d2a9f900ce.webp","motivation-und-belohnung-warum-wir-scheitern-und-was-hilft-ohne-moral.webp"
"0b8287d8-77d3-4e48-a0ab-d2812854b3ad","Mrt Ct Roentgen Unterschiede Orientierung",,"0b8287d8-77d3-4e48-a0ab-d2812854b3ad.webp","mrt-ct-roentgen-unterschiede-orientierung.webp"
"0a8f6e40-ccca-4354-bb25-8c1dcad73d35","Mythen Desinformation Typische Muster Erkennen Fakten Einordnen Orientierung",,"0a8f6e40-ccca-4354-bb25-8c1dcad73d35.webp","mythen-desinformation-typische-muster-erkennen-fakten-einordnen-orientierung.webp"
"63d608c1-89c2-404c-ac4e-d1d70953cb35","Mythen Fakten Reiss Dich Zusammen Panik Einordnung",,"63d608c1-89c2-404c-ac4e-d1d70953cb35.webp","mythen-fakten-reiss-dich-zusammen-panik-einordnung.webp"
"75360e2c-8db7-44b8-a15b-623f144e98e6","Mythen Fakten Zeit Heilt Alles Trauma Vergessen Einordnung",,"75360e2c-8db7-44b8-a15b-623f144e98e6.webp","mythen-fakten-zeit-heilt-alles-trauma-vergessen-einordnung.webp"
"875c6593-f321-4108-8f03-471648d04a96","Mythen Rund Ums Abnehmen Evidenz",,"875c6593-f321-4108-8f03-471648d04a96.webp","mythen-rund-ums-abnehmen-evidenz.webp"
"d972f757-f192-4a72-930d-11be57201712","Mythen Vs Fakten Impfungen",,"d972f757-f192-4a72-930d-11be57201712.webp","mythen-vs-fakten-impfungen.webp"
"f1a22c5a-17fd-4a6a-a5aa-d4fc327b58cf","Nahrungsmittelallergie Vs Unvertraeglichkeit Unterschied",,"f1a22c5a-17fd-4a6a-a5aa-d4fc327b58cf.webp","nahrungsmittelallergie-vs-unvertraeglichkeit-unterschied.webp"
"b9dad8ac-6483-414d-be1e-d5e807e8245b","Natuerlich Ist Besser Was Naturmittel Koennen Und Wo Grenzen Sind",,"b9dad8ac-6483-414d-be1e-d5e807e8245b.webp","natuerlich-ist-besser-was-naturmittel-koennen-und-wo-grenzen-sind.webp"
"9a1d70ae-9aff-4dc5-b0b3-6dd7cbaf8f81","Nebenwirkungen Verstehen Haeufigkeit Schwere Einordnung",,"9a1d70ae-9aff-4dc5-b0b3-6dd7cbaf8f81.webp","nebenwirkungen-verstehen-haeufigkeit-schwere-einordnung.webp"
"ace86a1d-0171-42d4-ad51-3c7887a81bf2","Nutzen Und Risiken Von Screening",,"ace86a1d-0171-42d4-ad51-3c7887a81bf2.webp","nutzen-und-risiken-von-screening.webp"
"ce8018c7-000d-4d46-b3b0-54d4713a4655","Omega 3 Magnesium Zink Co Studien",,"ce8018c7-000d-4d46-b3b0-54d4713a4655.webp","omega-3-magnesium-zink-co-studien.webp"
"930e4492-1b59-41a8-8458-24b4895354f6","Pacing Aktivitaet Haeufige Fehlannahmen",,"930e4492-1b59-41a8-8458-24b4895354f6.webp","pacing-aktivitaet-haeufige-fehlannahmen.webp"
"c54d4f38-5fa4-442a-bc64-2e76a2a47d3d","Parodontitis Risiko Verlauf Zusammenhang Allgemeingesundheit Orientierung",,"c54d4f38-5fa4-442a-bc64-2e76a2a47d3d.webp","parodontitis-risiko-verlauf-zusammenhang-allgemeingesundheit-orientierung.webp"
"b74d4e87-983b-4ac8-bb53-157ac21a922d","Patientenakte Patientenquittung Wozu Wie Anfordern Orientierung",,"b74d4e87-983b-4ac8-bb53-157ac21a922d.webp","patientenakte-patientenquittung-wozu-wie-anfordern-orientierung.webp"
"3dfe5746-b15b-46b8-b356-da95ab131908","Patientenrechte Aufklaerung Einsicht Datenschutz Orientierung",,"3dfe5746-b15b-46b8-b356-da95ab131908.webp","patientenrechte-aufklaerung-einsicht-datenschutz-orientierung.webp"
"bee80a71-06db-4616-a194-4a16201e87ee","Patientenschulung Warum Sie Hilft Wie Du Angebote Findest Orientierung",,"bee80a71-06db-4616-a194-4a16201e87ee.webp","patientenschulung-warum-sie-hilft-wie-du-angebote-findest-orientierung.webp"
"74118945-6d05-447c-a0d1-5dc089f228e5","Pflege Und Hilfsmittel Ansprueche Anlaufstellen Orientierung",,"74118945-6d05-447c-a0d1-5dc089f228e5.webp","pflege-und-hilfsmittel-ansprueche-anlaufstellen-orientierung.webp"
"0d8b269b-85e3-4392-b912-1558c3ec3995","Praevention Im Alltag Schlaf Stress Rhythmus Was Oft Wirkt",,"0d8b269b-85e3-4392-b912-1558c3ec3995.webp","praevention-im-alltag-schlaf-stress-rhythmus-was-oft-wirkt.webp"
"13f29aea-625c-41f6-9d95-d88faaf01dc3","Praevention Kondome Safer Sex Kommunikation Risiko Reduzieren",,"13f29aea-625c-41f6-9d95-d88faaf01dc3.webp","praevention-kondome-safer-sex-kommunikation-risiko-reduzieren.webp"
"227e3656-e67b-42d8-ae52-0275cb6b6679","Prostata Psa Frueherkennung Orientierung",,"227e3656-e67b-42d8-ae52-0275cb6b6679.webp","prostata-psa-frueherkennung-orientierung.webp"
"ade2b290-6ad7-414a-8f77-3b90d04ac3f0","Quellencheck Gute Gesundheitsinfos Erkennen",,"ade2b290-6ad7-414a-8f77-3b90d04ac3f0.webp","quellencheck-gute-gesundheitsinfos-erkennen.webp"
"b5ffc268-0cc2-4a80-b9f4-a80314b8735f","Rauchen Gesundheit Schaeden Risiko Passivrauch Einordnung",,"b5ffc268-0cc2-4a80-b9f4-a80314b8735f.webp","rauchen-gesundheit-schaeden-risiko-passivrauch-einordnung.webp"
"3b86b8ac-032d-408a-926a-b610dc3b604b","Reduzieren Statt Verbot Strategien Alkoholfreie Tage Warnsignale",,"3b86b8ac-032d-408a-926a-b610dc3b604b.webp","reduzieren-statt-verbot-strategien-alkoholfreie-tage-warnsignale.webp"
"717ee94a-c93b-4597-87ba-4ad64d3791e9","Reha Ziele Antrag Ablauf Orientierung",,"717ee94a-c93b-4597-87ba-4ad64d3791e9.webp","reha-ziele-antrag-ablauf-orientierung.webp"
"172c0be8-b118-4449-9dec-27dad7db13bd","Richtig Putzen Fluorid Was Wirklich Zaehlt",,"172c0be8-b118-4449-9dec-27dad7db13bd.webp","richtig-putzen-fluorid-was-wirklich-zaehlt.webp"
"f0e74118-77ce-4d38-a045-6b57af51e148","Risiken Folgeprobleme Herz Gehirn Niere Kontrolle Wichtig",,"f0e74118-77ce-4d38-a045-6b57af51e148.webp","risiken-folgeprobleme-herz-gehirn-niere-kontrolle-wichtig.webp"
"ea3d148f-f46b-43be-bf18-30e97dbfde44","Risiken Verstehen Wahrscheinlichkeit Haeufigkeit Unsicherheit Orientierung",,"ea3d148f-f46b-43be-bf18-30e97dbfde44.webp","risiken-verstehen-wahrscheinlichkeit-haeufigkeit-unsicherheit-orientierung.webp"
"86cf34b1-f813-4ede-ba9a-7a98e039fd79","Risikofrageboegen Stop Bang Epworth Was Sie Leisten Und Was Nicht",,"86cf34b1-f813-4ede-ba9a-7a98e039fd79.webp","risikofrageboegen-stop-bang-epworth-was-sie-leisten-und-was-nicht.webp"
"e14df4fb-e846-4586-aa40-5e10d553b9a2","Ruecken Haltung Gerader Ruecken Falsche Haltung Einordnung",,"e14df4fb-e846-4586-aa40-5e10d553b9a2.webp","ruecken-haltung-gerader-ruecken-falsche-haltung-einordnung.webp"
"17103756-f431-451a-8d53-ee5f9c20de2e","Rueckenschmerzen Verstehen Haeufige Ursachen Verlauf Einordnung",,"17103756-f431-451a-8d53-ee5f9c20de2e.webp","rueckenschmerzen-verstehen-haeufige-ursachen-verlauf-einordnung.webp"
"cf1150b8-15b1-4a77-b2d6-5bdea50f7c2f","Rueckfall Neustart Huerden Umgang Mit Stress Unterstuetzung Nutzen",,"cf1150b8-15b1-4a77-b2d6-5bdea50f7c2f.webp","rueckfall-neustart-huerden-umgang-mit-stress-unterstuetzung-nutzen.webp"
"3aa99fc9-f6f4-49c8-a43e-20bf41cf25cd","Schichtarbeit Jetlag Schlaf Ausnahmemodus Orientierung",,"3aa99fc9-f6f4-49c8-a43e-20bf41cf25cd.webp","schichtarbeit-jetlag-schlaf-ausnahmemodus-orientierung.webp"
"3da156fc-6f84-47ab-b2e1-28e3e794deea","Schilddruesen Mythen Unter Ueberfunktion Jod Symptome",,"3da156fc-6f84-47ab-b2e1-28e3e794deea.webp","schilddruesen-mythen-unter-ueberfunktion-jod-symptome.webp"
"c1181a64-1fdb-4eab-b144-171b03d589a9","Schlafapnoe Verstehen Orientierung",,"c1181a64-1fdb-4eab-b144-171b03d589a9.webp","schlafapnoe-verstehen-orientierung.webp"
"152f9da3-8564-4c18-9d99-9e522b22ace8","Schlafhygiene Licht Bildschirm Koffein Routine Was Wirklich Hilft",,"152f9da3-8564-4c18-9d99-9e522b22ace8.webp","schlafhygiene-licht-bildschirm-koffein-routine-was-wirklich-hilft.webp"
"0b684172-8d81-4111-b1f1-012e79872522","Schlafmittel Einordnen Nutzen Risiken Abhaengigkeit Orientierung",,"0b684172-8d81-4111-b1f1-012e79872522.webp","schlafmittel-einordnen-nutzen-risiken-abhaengigkeit-orientierung.webp"
"07a92746-2971-4c1e-a1fc-18a6c180b3e0","Schlaf Verstehen Schlafphasen Bedarf Warum Schlaf Wichtig Ist",,"07a92746-2971-4c1e-a1fc-18a6c180b3e0.webp","schlaf-verstehen-schlafphasen-bedarf-warum-schlaf-wichtig-ist.webp"
"6615294e-c677-4c59-9e17-8bba9029c9d4","Schlaganfall Tia Warnzeichen Verstehen Richtig Reagieren",,"6615294e-c677-4c59-9e17-8bba9029c9d4.webp","schlaganfall-tia-warnzeichen-verstehen-richtig-reagieren.webp"
"62210f8c-c34c-4543-9e18-91b551d8353b","Schmerzen Warnzeichen Wann Abklaeren Lassen Orientierung",,"62210f8c-c34c-4543-9e18-91b551d8353b.webp","schmerzen-warnzeichen-wann-abklaeren-lassen-orientierung.webp"
"a906ebf8-1e27-4621-a57d-c6016f00f8c9","Schmerz Und Fiebermittel Paracetamol Ibuprofen Ass Einordnung Typische Risiken",,"a906ebf8-1e27-4621-a57d-c6016f00f8c9.webp","schmerz-und-fiebermittel-paracetamol-ibuprofen-ass-einordnung-typische-risiken.webp"
"f73a930f-21de-422e-bc96-3e26756df9fc","Schwangerschaft Praenatale Untersuchungen Ultraschall Tests Einordnung",,"f73a930f-21de-422e-bc96-3e26756df9fc.webp","schwangerschaft-praenatale-untersuchungen-ultraschall-tests-einordnung.webp"
"92237755-8fb3-46d2-b8aa-368fb5ea854a","Selbsthilfe Und Bewegung Im Alltag Ohne Heilversprechen",,"92237755-8fb3-46d2-b8aa-368fb5ea854a.webp","selbsthilfe-und-bewegung-im-alltag-ohne-heilversprechen.webp"
"5370d26c-097a-4d26-97f4-b11070548fe5","Shared Decision Making Gemeinsam Entscheiden",,"5370d26c-097a-4d26-97f4-b11070548fe5.webp","shared-decision-making-gemeinsam-entscheiden.webp"
"ec117097-46f7-4700-ad65-804feeb63cf2","Sichere Anwendung Vor Der Einnahme Klaeren Orientierung",,"ec117097-46f7-4700-ad65-804feeb63cf2.webp","sichere-anwendung-vor-der-einnahme-klaeren-orientierung.webp"
"2963c1f3-476e-4974-96d1-53389a9f7511","Sitzen Alltag Schritte Pausen Rueckenfreundlichkeit Kleine Hebel",,"2963c1f3-476e-4974-96d1-53389a9f7511.webp","sitzen-alltag-schritte-pausen-rueckenfreundlichkeit-kleine-hebel.webp"
"1cc45f3e-7adb-4f5b-a31a-c9fb5b684909","Solarien Mythen Vorbraeunen Schuetzt",,"1cc45f3e-7adb-4f5b-a31a-c9fb5b684909.webp","solarien-mythen-vorbraeunen-schuetzt.webp"
"708aa6df-21bc-4290-a4f6-fabd5b1ab385","Solarium Kuenstliche Uv Risiken Mythen Vorbraeunen",,"708aa6df-21bc-4290-a4f6-fabd5b1ab385.webp","solarium-kuenstliche-uv-risiken-mythen-vorbraeunen.webp"
"b6ae8aba-8c91-424b-8a77-bac2a23de89d","Sonnencreme Mythen Toxisch Vitamin D Blockade Chemisch Mineralisch",,"b6ae8aba-8c91-424b-8a77-bac2a23de89d.webp","sonnencreme-mythen-toxisch-vitamin-d-blockade-chemisch-mineralisch.webp"
"d272695f-0725-446d-8d4f-d768da628b0e","Sonnenschutz Im Alltag Spf Richtig Eincremen Kleidung Schatten",,"d272695f-0725-446d-8d4f-d768da628b0e.webp","sonnenschutz-im-alltag-spf-richtig-eincremen-kleidung-schatten.webp"
"ab4074de-9848-4c9d-9185-1a3c923447dd","Spannungskopfschmerz Stress Haltung Muskelverspannung",,"ab4074de-9848-4c9d-9185-1a3c923447dd.webp","spannungskopfschmerz-stress-haltung-muskelverspannung.webp"
"202de368-fd50-496c-b9e1-8e8adc7fdb94","Sportverletzungen Typische Faelle Erste Schritte Wann Abklaeren Orientierung",,"202de368-fd50-496c-b9e1-8e8adc7fdb94.webp","sportverletzungen-typische-faelle-erste-schritte-wann-abklaeren-orientierung.webp"
"1027faac-13f9-414f-b20b-321f5355d118","Start Ohne Frust Muskelkater Aufwaermen Regeneration Basics",,"1027faac-13f9-414f-b20b-321f5355d118.webp","start-ohne-frust-muskelkater-aufwaermen-regeneration-basics.webp"
"4d6f273f-e809-418b-b175-6795d113d0a5","Sti Verstehen Ueberblick Infektionen Uebertragung Haeufigkeit",,"4d6f273f-e809-418b-b175-6795d113d0a5.webp","sti-verstehen-ueberblick-infektionen-uebertragung-haeufigkeit.webp"
"9c8ceea0-2b3e-488e-9f81-62fd5848fdb4","Stress Burnout Warnsignale Belastungsfaktoren Erholung Realistisch Planen",,"9c8ceea0-2b3e-488e-9f81-62fd5848fdb4.webp","stress-burnout-warnsignale-belastungsfaktoren-erholung-realistisch-planen.webp"
"7b8b6772-bc12-4c14-ab41-239921b06994","Stress Verstehen Koerperreaktion Symptome Wann Es Zu Viel Wird",,"7b8b6772-bc12-4c14-ab41-239921b06994.webp","stress-verstehen-koerperreaktion-symptome-wann-es-zu-viel-wird.webp"
"1e783579-58f1-44e3-bdc3-9f4aed134db5","Sucht Erkennen Warnzeichen Kontrollverlust Toleranz Entzug Orientierung",,"1e783579-58f1-44e3-bdc3-9f4aed134db5.webp","sucht-erkennen-warnzeichen-kontrollverlust-toleranz-entzug-orientierung.webp"
"95a95a6a-1b27-49d5-a7d9-045039e06e15","Suessstoffe Mythen Machen Dick Machen Diabetes Evidenz Einordnen",,"95a95a6a-1b27-49d5-a7d9-045039e06e15.webp","suessstoffe-mythen-machen-dick-machen-diabetes-evidenz-einordnen.webp"
"ccfb3e44-dc4a-40d5-94de-ba3af1614fb4","Supplements Was Es Ist Wann Sinnvoll Wann Eher Marketing Orientierung",,"ccfb3e44-dc4a-40d5-94de-ba3af1614fb4.webp","supplements-was-es-ist-wann-sinnvoll-wann-eher-marketing-orientierung.webp"
"95751496-a064-4147-9242-2eddce621af7","Symptome Typische Verlaeufe Wann Abklaeren Lassen Orientierung Keine Diagnose",,"95751496-a064-4147-9242-2eddce621af7.webp","symptome-typische-verlaeufe-wann-abklaeren-lassen-orientierung-keine-diagnose.webp"
"9f7f6e08-7347-4349-889f-22a03c68c187","Telefonische Beratung Hotlines Wann Sinnvoll Was Vorbereiten",,"9f7f6e08-7347-4349-889f-22a03c68c187.webp","telefonische-beratung-hotlines-wann-sinnvoll-was-vorbereiten.webp"
"e0663c9a-ff24-4302-964c-e92ea95f326a","Tests Bei Infekten Schnelltest Pcr Crp Orientierung",,"e0663c9a-ff24-4302-964c-e92ea95f326a.webp","tests-bei-infekten-schnelltest-pcr-crp-orientierung.webp"
"0713fb3d-9da7-4ba8-9836-716c05f52913","Tests Und Screening Welche Tests Wann Sinnvoll Fensterzeiten",,"0713fb3d-9da7-4ba8-9836-716c05f52913.webp","tests-und-screening-welche-tests-wann-sinnvoll-fensterzeiten.webp"
"526db99c-2167-420e-a243-eef91773efb3","Trauma Ptbs Verstehen Symptome Trigger Verlauf",,"526db99c-2167-420e-a243-eef91773efb3.webp","trauma-ptbs-verstehen-symptome-trigger-verlauf.webp"
"fd1a063a-7dda-45b7-9db7-7d1e3b22d174","Trigger Erkennen Kopfschmerz Migraenetagebuch Muster Finden",,"fd1a063a-7dda-45b7-9db7-7d1e3b22d174.webp","trigger-erkennen-kopfschmerz-migraenetagebuch-muster-finden.webp"
"05c8397c-082f-4916-ba00-c7020891846b","Trigger Ernaehrung Koffein Alkohol Einordnung Ohne Dogma",,"05c8397c-082f-4916-ba00-c7020891846b.webp","trigger-ernaehrung-koffein-alkohol-einordnung-ohne-dogma.webp"
"17ec5be3-e93e-4323-8106-348a79692bf3","Uebergewicht Adipositas Verstehen Ursachen Einordnung",,"17ec5be3-e93e-4323-8106-348a79692bf3.webp","uebergewicht-adipositas-verstehen-ursachen-einordnung.webp"
"8f8027f0-8208-41e0-a521-f9b0099646e2","Ueberlastung Vermeiden Sehnen Gelenke Dosierung Stufenweise Steigern",,"8f8027f0-8208-41e0-a521-f9b0099646e2.webp","ueberlastung-vermeiden-sehnen-gelenke-dosierung-stufenweise-steigern.webp"
"93f1f7d3-189e-4301-b9fe-e94b6035ed4b","Uebungen Und Programme Rueckenschule Trainingsplaene Was Taugt Wirklich",,"93f1f7d3-189e-4301-b9fe-e94b6035ed4b.webp","uebungen-und-programme-rueckenschule-trainingsplaene-was-taugt-wirklich.webp"
"adbfcade-a21b-427e-85a1-df50a711da3b","Unterstuetzung Finden Abklaerung Therapie Schule Arbeit Orientierung",,"adbfcade-a21b-427e-85a1-df50a711da3b.webp","unterstuetzung-finden-abklaerung-therapie-schule-arbeit-orientierung.webp"
"cafa8c51-9511-431e-94af-15e24dd46308","Unterstuetzung Im Alltag Hilfen Antraege Versorgungspfade Orientierung",,"cafa8c51-9511-431e-94af-15e24dd46308.webp","unterstuetzung-im-alltag-hilfen-antraege-versorgungspfade-orientierung.webp"
"d8ee4ee1-001e-4352-bde3-85ffb495f553","Uv Und Haut Was Uv Strahlung Macht Warum Sonnenbrand Nicht Harmlos Ist",,"d8ee4ee1-001e-4352-bde3-85ffb495f553.webp","uv-und-haut-was-uv-strahlung-macht-warum-sonnenbrand-nicht-harmlos-ist.webp"
"bac40e02-e6ba-4210-8694-272963152acf","Verhaltenssuechte Gaming Kaufen Sport Internet Einordnung Hilfewege",,"bac40e02-e6ba-4210-8694-272963152acf.webp","verhaltenssuechte-gaming-kaufen-sport-internet-einordnung-hilfewege.webp"
"86c7f4c1-c1e9-43de-868e-0f4dbbe9c871","Viral Vs Bakteriell Warum Das Wichtig Ist Orientierung",,"86c7f4c1-c1e9-43de-868e-0f4dbbe9c871.webp","viral-vs-bakteriell-warum-das-wichtig-ist-orientierung.webp"
"581db302-4a7c-437d-af9a-710f34f72f17","Vitamin D Sonne Wie Viel Sonne Sinnvoll Ohne Extreme",,"581db302-4a7c-437d-af9a-710f34f72f17.webp","vitamin-d-sonne-wie-viel-sonne-sinnvoll-ohne-extreme.webp"
"fa24db91-7f8f-4a6a-a813-77bf446c3b0b","Vitamin D Spiegel Mangel Sonne Einordnung",,"fa24db91-7f8f-4a6a-a813-77bf446c3b0b.webp","vitamin-d-spiegel-mangel-sonne-einordnung.webp"
"7a054d31-8e6d-419c-9dca-d69cd3976a08","Vitamin D Und Sonne Wie Haengt Das Zusammen",,"7a054d31-8e6d-419c-9dca-d69cd3976a08.webp","vitamin-d-und-sonne-wie-haengt-das-zusammen.webp"
"66418218-e4fb-44f9-a30a-64aa784494c6","Vitamine Mineralstoffe Wann Sinnvoll Wann Ueberfluessig",,"66418218-e4fb-44f9-a30a-64aa784494c6.webp","vitamine-mineralstoffe-wann-sinnvoll-wann-ueberfluessig.webp"
"c6444b81-9d51-4d30-9001-515c4c426704","Vorsorge Im Alter Impfungen Alltag",,"c6444b81-9d51-4d30-9001-515c4c426704.webp","vorsorge-im-alter-impfungen-alltag.webp"
"8b7cfc6e-74af-4d65-b7f2-a4ad3279084c","Vorsorge Kinder Jugendliche Untersuchungen Entwicklung Wann Abklaeren",,"8b7cfc6e-74af-4d65-b7f2-a4ad3279084c.webp","vorsorge-kinder-jugendliche-untersuchungen-entwicklung-wann-abklaeren.webp"
"a3615dbd-631a-4960-a429-8501e93c3f56","Vorsorgeuntersuchung Oesterreich Ablauf Inhalte Vorbereitung",,"a3615dbd-631a-4960-a429-8501e93c3f56.webp","vorsorgeuntersuchung-oesterreich-ablauf-inhalte-vorbereitung.webp"
"e93db25c-835c-4443-93d6-5fee36853140","Vorsorge Verstehen Nutzen Risiken Haeufigkeit",,"e93db25c-835c-4443-93d6-5fee36853140.webp","vorsorge-verstehen-nutzen-risiken-haeufigkeit.webp"
"9e2431ed-f8f4-4db0-a9a4-045d09cf8e18","Wann Kopfschmerzen EIN Warnsignal Sind Red Flags Abklaerung",,"9e2431ed-f8f4-4db0-a9a4-045d09cf8e18.webp","wann-kopfschmerzen-ein-warnsignal-sind-red-flags-abklaerung.webp"
"4513f285-24ad-4387-ab48-fbbbc42dfe96","Wann Zum Arzt Warnzeichen Dauer Risiko Orientierung",,"4513f285-24ad-4387-ab48-fbbbc42dfe96.webp","wann-zum-arzt-warnzeichen-dauer-risiko-orientierung.webp"
"502e576c-4335-4065-8174-33c98b333d7c","Warnzeichen Bei Rueckenschmerzen Wann Aerztlich Abklaeren",,"502e576c-4335-4065-8174-33c98b333d7c.webp","warnzeichen-bei-rueckenschmerzen-wann-aerztlich-abklaeren.webp"
"3de1b2ac-1c98-48b3-ba66-e9ca12aa2af3","Warnzeichen Im Mund Wann Abklaeren",,"3de1b2ac-1c98-48b3-ba66-e9ca12aa2af3.webp","warnzeichen-im-mund-wann-abklaeren.webp"
"ce6a9319-0a6c-45f7-9bfc-b82b1f688146","Warnzeichen Notfall Wann Rasch Handeln Sinnvoll Ist",,"ce6a9319-0a6c-45f7-9bfc-b82b1f688146.webp","warnzeichen-notfall-wann-rasch-handeln-sinnvoll-ist.webp"
"c9c67f56-29db-454d-becd-cdc55ecb5cde","Warnzeichen Wechselwirkungen Worauf Achten Was Nachfragen Orientierung",,"c9c67f56-29db-454d-becd-cdc55ecb5cde.webp","warnzeichen-wechselwirkungen-worauf-achten-was-nachfragen-orientierung.webp"
"55c30373-4596-4303-ab85-f9b7c872d152","Was Hilft Im Alltag Waerme Bewegung Erholung Orientierung",,"55c30373-4596-4303-ab85-f9b7c872d152.webp","was-hilft-im-alltag-waerme-bewegung-erholung-orientierung.webp"
"6e770269-d67b-43a2-b6d0-c648811299e7","Was Hilft Schlafberatung Therapieoptionen Wann Abklaeren Orientierung",,"6e770269-d67b-43a2-b6d0-c648811299e7.webp","was-hilft-schlafberatung-therapieoptionen-wann-abklaeren-orientierung.webp"
"97270596-6986-46cd-a786-ead38ad47758","Was Zahlt Die Kasse Ueberweisung Ecard Kostenuebernahme Orientierung",,"97270596-6986-46cd-a786-ead38ad47758.webp","was-zahlt-die-kasse-ueberweisung-ecard-kostenuebernahme-orientierung.webp"
"11f1171e-4f61-45c5-8c7b-7cd3809d317c","Wichtige Frueherkennungen Darm Brust Gebaermutterhals Haut Einordnung",,"11f1171e-4f61-45c5-8c7b-7cd3809d317c.webp","wichtige-frueherkennungen-darm-brust-gebaermutterhals-haut-einordnung.webp"
"dbf4812a-b703-476e-9070-d69aeb9fd65a","Wichtige Impfungen Im Ueberblick Mmr Hpv Influenza Fsme Pneumokokken",,"dbf4812a-b703-476e-9070-d69aeb9fd65a.webp","wichtige-impfungen-im-ueberblick-mmr-hpv-influenza-fsme-pneumokokken.webp"
"9baeea7c-4234-4202-b36d-0e7804cebcf3","Wie Alkohol Wirkt Koerper Gehirn Schlaf Abbau Einordnung",,"9baeea7c-4234-4202-b36d-0e7804cebcf3.webp","wie-alkohol-wirkt-koerper-gehirn-schlaf-abbau-einordnung.webp"
"144bbdf8-a880-4ce8-a92c-646505a74d8b","Wohin Wann Hausarzt Facharzt Ambulanz Notfall Orientierung",,"144bbdf8-a880-4ce8-a92c-646505a74d8b.webp","wohin-wann-hausarzt-facharzt-ambulanz-notfall-orientierung.webp"
"83392c3b-6e78-47dd-8298-e39fb735077f","Wundermittel Erkennen Typische Muster Von Gesundheitsversprechen",,"83392c3b-6e78-47dd-8298-e39fb735077f.webp","wundermittel-erkennen-typische-muster-von-gesundheitsversprechen.webp"
"6de457d6-980c-40e7-b628-0330474efb9b","Zahngesundheit Bei Kindern Milchzaehne Vorsorge Versiegelung Fluorid Orientierung",,"6de457d6-980c-40e7-b628-0330474efb9b.webp","zahngesundheit-bei-kindern-milchzaehne-vorsorge-versiegelung-fluorid-orientierung.webp"
"cd8278cb-0591-46a5-8fce-41b867e29994","Zahngesundheit Verstehen Karies Parodontitis Vorsorge",,"cd8278cb-0591-46a5-8fce-41b867e29994.webp","zahngesundheit-verstehen-karies-parodontitis-vorsorge.webp"
"b4b75710-1c11-4da5-aed3-32fc149e2a2f","Ziele Setzen Planen Realistisch Kleine Schritte Umsetzungshilfen",,"b4b75710-1c11-4da5-aed3-32fc149e2a2f.webp","ziele-setzen-planen-realistisch-kleine-schritte-umsetzungshilfen.webp"
